question,answer,contexts,ground_truth,context_precision,context_recall,faithfulness,answer_relevancy
What is the improved F1-score when MobileNetV2 is used?,The improved weighted F1-score when MobileNetV2 is used is 0.87. This represents an enhancement of normal-class detection by approximately 50% compared to the initial score of 0.67.,"['•DevelopedinferencepipelineandFlaskRESTAPItoservereal-timepredictions(AVM).\n•ImplementedMLOpsCI/CDpipelines(GitHubActions)anddeployedmodelonAzureAppService.\nPneumonia Detection via Chest X-Rays: Deep Learning Comparative Study | Code Link\n•BuiltCNNandMobileNetV2transferlearningmodelsforchestX-rayimageclassification(pneumoniadetection).\n•ImprovedweightedF1-scorefrom0.67to0.87usingMobileNetV2,enhancingnormal-classdetectionby ∼50%.\n•Evaluatedmodelsusingprecision–recallandF1metrics;identifiedMobileNetV2asbestfordeployment.\nAchievements and Certificates\n•AppliedDataSciencewithPython-Level2(IBM: Badge)\n•DeepLearninginTensorflow(Dataquest: Certificate )\n•SQLDatabasesforDevelopers: Foundations(Oracle: Certificate )\nEducation\nCentral University of Rajasthan, Ajmer, Rajasthan June2023-Jun2026\nDoctorofPhilosophy(PhD)\nAppliedandComputationalMathematics'
 '•DevelopedinferencepipelineandFlaskRESTAPItoservereal-timepredictions(AVM).\n•ImplementedMLOpsCI/CDpipelines(GitHubActions)anddeployedmodelonAzureAppService.\nPneumonia Detection via Chest X-Rays: Deep Learning Comparative Study | Code Link\n•BuiltCNNandMobileNetV2transferlearningmodelsforchestX-rayimageclassification(pneumoniadetection).\n•ImprovedweightedF1-scorefrom0.67to0.87usingMobileNetV2,enhancingnormal-classdetectionby ∼50%.\n•Evaluatedmodelsusingprecision–recallandF1metrics;identifiedMobileNetV2asbestfordeployment.\nAchievements and Certificates\n•AppliedDataSciencewithPython-Level2(IBM: Badge)\n•DeepLearninginTensorflow(Dataquest: Certificate )\n•SQLDatabasesforDevelopers: Foundations(Oracle: Certificate )\nEducation\nCentral University of Rajasthan, Ajmer, Rajasthan June2023-Jun2026\nDoctorofPhilosophy(PhD)\nAppliedandComputationalMathematics'
 '•DevelopedinferencepipelineandFlaskRESTAPItoservereal-timepredictions(AVM).\n•ImplementedMLOpsCI/CDpipelines(GitHubActions)anddeployedmodelonAzureAppService.\nPneumonia Detection via Chest X-Rays: Deep Learning Comparative Study | Code Link\n•BuiltCNNandMobileNetV2transferlearningmodelsforchestX-rayimageclassification(pneumoniadetection).\n•ImprovedweightedF1-scorefrom0.67to0.87usingMobileNetV2,enhancingnormal-classdetectionby ∼50%.\n•Evaluatedmodelsusingprecision–recallandF1metrics;identifiedMobileNetV2asbestfordeployment.\nAchievements and Certificates\n•AppliedDataSciencewithPython-Level2(IBM: Badge)\n•DeepLearninginTensorflow(Dataquest: Certificate )\n•SQLDatabasesforDevelopers: Foundations(Oracle: Certificate )\nEducation\nCentral University of Rajasthan, Ajmer, Rajasthan June2023-Jun2026\nDoctorofPhilosophy(PhD)\nAppliedandComputationalMathematics']",0.87,0.9999999999666667,1.0,1.0,0.7777299016987711
What is the R2 score while using XGBoost regression model?,The R2 score while using XGBoost regression model is 0.93.,"['•AppliedNLPpreprocessingandembeddings(Word2Vec,BERT)onNewsSumdatasetusingTensorFlowandPyTorch.\n•Evaluated10+LLMs(T5,LLaMA,Gemma)usingROUGE-1/2/LandBERTScoreforabstractivesummarization.\n•Developednewattention-basedtextsummarizationmodeltoimprovesemanticsimilarityandROUGEmetrics.\nLloyds Banking Group Jan2026-Jan2026\nData Science Job Simulation |ProjectLink\n•Builtcustomerchurnclassificationmodel(RandomForest,Scikit-learn)achievingROC-AUC=0.87.\n•Performedfeatureengineeringandimbalancehandling(ROS,One-HotEncoding)usingPandasandNumPy.\n•ConductedEDAandvisualization(Matplotlib,Seaborn)toanalyzefeaturedistributionsandcorrelations.\nProject Work\nProduction-Ready House Price Prediction System | Live Link\n•BuiltXGBoostregressionmodel(R2=0.93)withfeatureengineeringforautomatedhousepriceprediction.\n•DevelopedinferencepipelineandFlaskRESTAPItoservereal-timepredictions(AVM).\n•ImplementedMLOpsCI/CDpipelines(GitHubActions)anddeployedmodelonAzureAppService.'
 '•AppliedNLPpreprocessingandembeddings(Word2Vec,BERT)onNewsSumdatasetusingTensorFlowandPyTorch.\n•Evaluated10+LLMs(T5,LLaMA,Gemma)usingROUGE-1/2/LandBERTScoreforabstractivesummarization.\n•Developednewattention-basedtextsummarizationmodeltoimprovesemanticsimilarityandROUGEmetrics.\nLloyds Banking Group Jan2026-Jan2026\nData Science Job Simulation |ProjectLink\n•Builtcustomerchurnclassificationmodel(RandomForest,Scikit-learn)achievingROC-AUC=0.87.\n•Performedfeatureengineeringandimbalancehandling(ROS,One-HotEncoding)usingPandasandNumPy.\n•ConductedEDAandvisualization(Matplotlib,Seaborn)toanalyzefeaturedistributionsandcorrelations.\nProject Work\nProduction-Ready House Price Prediction System | Live Link\n•BuiltXGBoostregressionmodel(R2=0.93)withfeatureengineeringforautomatedhousepriceprediction.\n•DevelopedinferencepipelineandFlaskRESTAPItoservereal-timepredictions(AVM).\n•ImplementedMLOpsCI/CDpipelines(GitHubActions)anddeployedmodelonAzureAppService.'
 '•AppliedNLPpreprocessingandembeddings(Word2Vec,BERT)onNewsSumdatasetusingTensorFlowandPyTorch.\n•Evaluated10+LLMs(T5,LLaMA,Gemma)usingROUGE-1/2/LandBERTScoreforabstractivesummarization.\n•Developednewattention-basedtextsummarizationmodeltoimprovesemanticsimilarityandROUGEmetrics.\nLloyds Banking Group Jan2026-Jan2026\nData Science Job Simulation |ProjectLink\n•Builtcustomerchurnclassificationmodel(RandomForest,Scikit-learn)achievingROC-AUC=0.87.\n•Performedfeatureengineeringandimbalancehandling(ROS,One-HotEncoding)usingPandasandNumPy.\n•ConductedEDAandvisualization(Matplotlib,Seaborn)toanalyzefeaturedistributionsandcorrelations.\nProject Work\nProduction-Ready House Price Prediction System | Live Link\n•BuiltXGBoostregressionmodel(R2=0.93)withfeatureengineeringforautomatedhousepriceprediction.\n•DevelopedinferencepipelineandFlaskRESTAPItoservereal-timepredictions(AVM).\n•ImplementedMLOpsCI/CDpipelines(GitHubActions)anddeployedmodelonAzureAppService.']",0.93,0.9999999999666667,1.0,1.0,0.853671452628577
